### ISSUE TITLE
My Feyree EV charger stopped working (Failed to refresh device state for Feyree EV charger)

### ISSUE THREAD

**Issue by istaveren** [make-all/tuya-local#4862]
### Description

Sinds yesterday the EV charger is not displayed anymore in HA.

I have tried all kind of things like downgrade tuya-local and HA core. But didn't seem to help.

### Steps to reproduce

1. It was already installed
2. Look at the entities at Tuya Local
3. Configuration failed

### Expected behaviour

1. It is configured
2. Shows the values of the device like voltage, charger state etc.

### Additional context

I enabled debug level logging.
This is the result.

```
2026-04-09 19:58:21.742 DEBUG (MainThread) [custom_components.tuya_local] Setting up entry for device: bfcf358e06278286e9mz7j
2026-04-09 19:58:21.743 INFO (SyncWorker_1) [custom_components.tuya_local.device] Creating device: bfcf358e06278286e9mz7j
2026-04-09 19:58:21.744 DEBUG (MainThread) [custom_components.tuya_local.device] Refreshing device state for Feyree EV charger
2026-04-09 19:58:21.745 DEBUG (MainThread) [custom_components.tuya_local.device] Setting protocol version for Feyree EV charger to 3.4
2026-04-09 19:58:21.747 DEBUG (SyncWorker_6) [tinytuya.core.XenonDevice] status() entry (dev_type is default)
2026-04-09 19:58:21.747 DEBUG (SyncWorker_6) [tinytuya.core.XenonDevice] final payload_dict for 'bfcf358e06278286e9mz7j' ('v3.4'/'default'): {1: {'command': {'gwId': '', 'devId': '', 'uid': '', 't': ''}}, 7: {'command': {'protocol': 5, 't': 'int', 'data': {}}, 'command_override': 13}, 8: {'command': {'gwId': '', 'devId': ''}}, 9: {'command': {'gwId': '', 'devId': ''}}, 10: {'command': {}, 'command_override': 16}, 13: {'command': {'protocol': 5, 't': 'int', 'data': {}}}, 16: {'command': {}}, 18: {'command': {'dpId': [18, 19, 20]}}, 64: {'command': {'reqType': '', 'data': {}}}}
2026-04-09 19:58:21.747 DEBUG (SyncWorker_6) [tinytuya.core.XenonDevice] building command 10 payload=b'{}'
2026-04-09 19:58:21.754 DEBUG (SyncWorker_6) [tinytuya.core.XenonDevice] sending payload quick
2026-04-09 19:58:21.754 DEBUG (SyncWorker_6) [tinytuya.core.XenonDevice] final payload: b'0123456789abcdef'
2026-04-09 19:58:21.754 DEBUG (SyncWorker_6) [tinytuya.core.XenonDevice] payload encrypted=b'000055aa0000000d0000000*******614f0b595a0000aa55'
2026-04-09 19:58:21.763 DEBUG (SyncWorker_6) [tinytuya.core.XenonDevice] received null payload (None), fetch new one - 1 retries remaining
2026-04-09 19:58:21.763 DEBUG (SyncWorker_6) [tinytuya.core.XenonDevice] _recv_all(): no data? b''
2026-04-09 19:58:21.774 DEBUG (SyncWorker_6) [tinytuya.core.XenonDevice] _recv_all(): no data? b''
2026-04-09 19:58:21.774 DEBUG (SyncWorker_6) [tinytuya.core.XenonDevice] received null payload (None) but out of recv retries, giving up
2026-04-09 19:58:21.774 DEBUG (SyncWorker_6) [tinytuya.core.XenonDevice] session key negotiation failed on step 1
2026-04-09 19:58:21.775 DEBUG (SyncWorker_6) [tinytuya.core.error_helper] ERROR Check device key or version - 914 - payload: null
2026-04-09 19:58:21.776 DEBUG (SyncWorker_6) [tinytuya.core.XenonDevice] status() received data={'Error': 'Check device key or version', 'Err': '914', 'Payload': None}
2026-04-09 19:58:21.776 DEBUG (SyncWorker_6) [custom_components.tuya_local.device] Feyree EV charger protocol error 914: Check device key or version
2026-04-09 19:58:21.776 DEBUG (SyncWorker_6) [custom_components.tuya_local.device] Feyree EV charger refreshed device state: {"Error": "Check device key or version", "Err": "914", "Payload": null}
2026-04-09 19:58:21.776 DEBUG (SyncWorker_6) [custom_components.tuya_local.device] new state (incl pending): {"updated_at": 0}
2026-04-09 19:58:21.777 DEBUG (MainThread) [custom_components.tuya_local.device] Retrying after exception AttributeError Check device key or version (0/3)
2026-04-09 19:58:21.777 DEBUG (MainThread) [custom_components.tuya_local.device] Setting protocol version for Feyree EV charger to 3.4
2026-04-09 19:58:21.780 DEBUG (SyncWorker_4) [tinytuya.core.XenonDevice] status() entry (dev_type is default)
2026-04-09 19:58:21.780 DEBUG (SyncWorker_4) [tinytuya.core.XenonDevice] final payload_dict for 'bfcf358e06278286e9mz7j' ('v3.4'/'default'): {1: {'command': {'gwId': '', 'devId': '', 'uid': '', 't': ''}}, 7: {'command': {'protocol': 5, 't': 'int', 'data': {}}, 'command_override': 13}, 8: {'command': {'gwId': '', 'devId': ''}}, 9: {'command': {'gwId': '', 'devId': ''}}, 10: {'command': {}, 'command_override': 16}, 13: {'command': {'protocol': 5, 't': 'int', 'data': {}}}, 16: {'command': {}}, 18: {'command': {'dpId': [18, 19, 20]}}, 64: {'command': {'reqType': '', 'data': {}}}}
2026-04-09 19:58:21.780 DEBUG (SyncWorker_4) [tinytuya.core.XenonDevice] building command 10 payload=b'{}'
2026-04-09 19:58:21.787 DEBUG (SyncWorker_4) [tinytuya.core.XenonDevice] sending payload quick
2026-04-09 19:58:21.787 DEBUG (SyncWorker_4) [tinytuya.core.XenonDevice] final payload: b'0123456789abcdef'
2026-04-09 19:58:21.787 DEBUG (SyncWorker_4) [tinytuya.core.XenonDevice] payload encrypted=b'000055aa0000000e00*********b10000aa55'
2026-04-09 19:58:21.795 DEBUG (SyncWorker_4) [tinytuya.core.XenonDevice] received null payload (None), fetch new one - 1 retries remaining
2026-04-09 19:58:21.796 DEBUG (SyncWorker_4) [tinytuya.core.XenonDevice] _recv_all(): no data? b''
2026-04-09 19:58:21.806 DEBUG (SyncWorker_4) [tinytuya.core.XenonDevice] _recv_all(): no data? b''
2026-04-09 19:58:21.806 DEBUG (SyncWorker_4) [tinytuya.core.XenonDevice] received null payload (None) but out of recv retries, giving up
2026-04-09 19:58:21.807 DEBUG (SyncWorker_4) [tinytuya.core.XenonDevice] session key negotiation failed on step 1
2026-04-09 19:58:21.808 DEBUG (SyncWorker_4) [tinytuya.core.error_helper] ERROR Check device key or version - 914 - payload: null
2026-04-09 19:58:21.808 DEBUG (SyncWorker_4) [tinytuya.core.XenonDevice] status() received data={'Error': 'Check device key or version', 'Err': '914', 'Payload': None}
2026-04-09 19:58:21.808 DEBUG (SyncWorker_4) [custom_components.tuya_local.device] Feyree EV charger protocol error 914: Check device key or version
2026-04-09 19:58:21.808 DEBUG (SyncWorker_4) [custom_components.tuya_local.device] Feyree EV charger refreshed device state: {"Error": "Check device key or version", "Err": "914", "Payload": null}
2026-04-09 19:58:21.808 DEBUG (SyncWorker_4) [custom_components.tuya_local.device] new state (incl pending): {"updated_at": 0}
2026-04-09 19:58:21.809 DEBUG (MainThread) [custom_components.tuya_local.device] Retrying after exception AttributeError Check device key or version (1/3)
2026-04-09 19:58:21.809 DEBUG (MainThread) [custom_components.tuya_local.device] Setting protocol version for Feyree EV charger to 3.4
2026-04-09 19:58:21.812 DEBUG (SyncWorker_5) [tinytuya.core.XenonDevice] status() entry (dev_type is default)
2026-04-09 19:58:21.813 DEBUG (SyncWorker_5) [tinytuya.core.XenonDevice] final payload_dict for 'bfcf358e06278286e9mz7j' ('v3.4'/'default'): {1: {'command': {'gwId': '', 'devId': '', 'uid': '', 't': ''}}, 7: {'command': {'protocol': 5, 't': 'int', 'data': {}}, 'command_override': 13}, 8: {'command': {'gwId': '', 'devId': ''}}, 9: {'command': {'gwId': '', 'devId': ''}}, 10: {'command': {}, 'command_override': 16}, 13: {'command': {'protocol': 5, 't': 'int', 'data': {}}}, 16: {'command': {}}, 18: {'command': {'dpId': [18, 19, 20]}}, 64: {'command': {'reqType': '', 'data': {}}}}
2026-04-09 19:58:21.813 DEBUG (SyncWorker_5) [tinytuya.core.XenonDevice] building command 10 payload=b'{}'
2026-04-09 19:58:21.819 DEBUG (SyncWorker_5) [tinytuya.core.XenonDevice] sending payload quick
2026-04-09 19:58:21.819 DEBUG (SyncWorker_5) [tinytuya.core.XenonDevice] final payload: b'0123456789abcdef'
2026-04-09 19:58:21.820 DEBUG (SyncWorker_5) [tinytuya.core.XenonDevice] payload encrypted=b'000055aa0000000f000000030*******90000aa55'
2026-04-09 19:58:21.829 DEBUG (SyncWorker_5) [tinytuya.core.XenonDevice] received null payload (None), fetch new one - 1 retries remaining
2026-04-09 19:58:21.830 DEBUG (SyncWorker_5) [tinytuya.core.XenonDevice] _recv_all(): no data? b''
2026-04-09 19:58:21.840 DEBUG (SyncWorker_5) [tinytuya.core.XenonDevice] _recv_all(): no data? b''
2026-04-09 19:58:21.841 DEBUG (SyncWorker_5) [tinytuya.core.XenonDevice] received null payload (None) but out of recv retries, giving up
2026-04-09 19:58:21.841 DEBUG (SyncWorker_5) [tinytuya.core.XenonDevice] session key negotiation failed on step 1
2026-04-09 19:58:21.842 DEBUG (SyncWorker_5) [tinytuya.core.error_helper] ERROR Check device key or version - 914 - payload: null
2026-04-09 19:58:21.842 DEBUG (SyncWorker_5) [tinytuya.core.XenonDevice] status() received data={'Error': 'Check device key or version', 'Err': '914', 'Payload': None}
2026-04-09 19:58:21.842 DEBUG (SyncWorker_5) [custom_components.tuya_local.device] Feyree EV charger protocol error 914: Check device key or version
2026-04-09 19:58:21.842 DEBUG (SyncWorker_5) [custom_components.tuya_local.device] Feyree EV charger refreshed device state: {"Error": "Check device key or version", "Err": "914", "Payload": null}
2026-04-09 19:58:21.842 DEBUG (SyncWorker_5) [custom_components.tuya_local.device] new state (incl pending): {"updated_at": 0}
2026-04-09 19:58:21.843 DEBUG (MainThread) [custom_components.tuya_local.device] Retrying after exception AttributeError Check device key or version (2/3)
2026-04-09 19:58:21.844 ERROR (MainThread) [custom_components.tuya_local.device] Failed to refresh device state for Feyree EV charger.
2026-04-09 19:58:21.844 DEBUG (MainThread) [custom_components.tuya_local.device] Setting protocol version for Feyree EV charger to 3.4

```

The device still works fine in the Tuya app.
I run the latest release of tuya-local.

### Confirmation

- [x] I am sure this is a bug or improvement, that is well enough described that it can be implemented.
- [x] This report is for make-all/tuya-local, **not** for localtuya, a modified tuya-local not from make-all, the Tuya app or cloud.
- [x] The device this issue is about is externally powered, or connecting via a hub (battery powered WiFi devices are NOT supported by this integration).
- [x] I have checked the latest released version of tuya-local
- [x] If this is for a specific device, the device config filename is mentioned above, or diagnostics are included.

- [x] Log messages or diagnostics relevant to the issue are included.

- [x] This is not requesting addition of a new device.

**Comment by BenasBud** [comment]
Not sure if its related, but started seeing a lot of warning for same type of charger.
Other functions for the charger and state - seems to be updating / working.

Error:
```
2026-04-09 23:07:55.463 WARNING (MainThread) [custom_components.tuya_local.device] EV Charger error reading: Unexpected Payload from Device
```

Debug logs during error:
```
...
2026-04-09 23:23:49.581 DEBUG (SyncWorker_13) [tinytuya.core.XenonDevice] removing 3.x=b'{"protocol":4,"t":1775766228,"data":{"dps":{"120":"00:24:26"}}}'
2026-04-09 23:23:49.581 DEBUG (SyncWorker_13) [tinytuya.core.XenonDevice] decoded results='{"protocol":4,"t":1775766228,"data":{"dps":{"120":"00:24:26"}}}'
2026-04-09 23:23:49.582 DEBUG (SyncWorker_13) [tinytuya.core.XenonDevice] caching: {'protocol': 4, 't': 1775766228, 'data': {'dps': {'120': '00:24:26'}}, 'dps': {'120': '00:24:26'}}
2026-04-09 23:23:49.582 DEBUG (SyncWorker_13) [tinytuya.core.XenonDevice] merged: {'dps': {'10': 0, '101': 'charing', '102': 2292, '105': 83, '109': 19, '110': 310, '112': 7, '113': 'Max16A', '114': 8, '118': 0, '119': 0, '120': '00:24:26', '123': 'GND', '124': 'OpenCharging', '127': 6}, 'protocol': 4, 't': 1775766228, 'data': {'dps': {'120': '00:24:26'}}}
2026-04-09 23:23:49.588 DEBUG (MainThread) [custom_components.tuya_local.device] EV Charger received {"120": "00:24:26", "full_poll": false}
2026-04-09 23:23:49.590 DEBUG (MainThread) [custom_components.tuya_local.helpers.device_config] EV charger: Mapped dps 113 value from Max16A to 6
2026-04-09 23:23:49.590 DEBUG (MainThread) [custom_components.tuya_local.helpers.device_config] EV charger: Mapped dps 113 value from Max16A to 16
2026-04-09 23:23:49.592 DEBUG (MainThread) [custom_components.tuya_local.helpers.device_config] EV charger: Mapped dps 101 value from charing to charging
2026-04-09 23:23:49.594 DEBUG (MainThread) [custom_components.tuya_local.helpers.device_config] EV charger: Mapped dps 109 value from 19 to 1.9
2026-04-09 23:23:49.594 DEBUG (MainThread) [custom_components.tuya_local.helpers.device_config] EV charger: Mapped dps 110 value from 310 to 31.0
2026-04-09 23:23:49.595 DEBUG (MainThread) [custom_components.tuya_local.helpers.device_config] EV charger: Mapped dps 102 value from 2292 to 229.2
2026-04-09 23:23:49.598 DEBUG (MainThread) [custom_components.tuya_local.helpers.device_config] EV charger: Mapped dps 105 value from 83 to 8.3
2026-04-09 23:23:49.599 DEBUG (MainThread) [custom_components.tuya_local.helpers.device_config] EV charger: Mapped dps 112 value from 7 to 0.7
2026-04-09 23:23:49.599 DEBUG (MainThread) [custom_components.tuya_local.helpers.device_config] EV charger: Mapped dps 27 value from None to False
2026-04-09 23:23:49.600 DEBUG (MainThread) [custom_components.tuya_local.helpers.device_config] EV charger: Mapped dps 10 value from 0 to False
2026-04-09 23:23:49.600 DEBUG (MainThread) [custom_components.tuya_local.helpers.device_config] EV charger: Mapped dps 10 value from 0 to Ready
2026-04-09 23:23:49.600 DEBUG (MainThread) [custom_components.tuya_local.helpers.device_config] EV charger: Mapped dps 124 value from OpenCharging to on
2026-04-09 23:23:50.777 DEBUG (SyncWorker_8) [tinytuya.core.XenonDevice] _recv_all(): no data? b''
2026-04-09 23:23:50.788 DEBUG (SyncWorker_8) [tinytuya.core.XenonDevice] _recv_all(): no data? b''
2026-04-09 23:23:50.788 DEBUG (SyncWorker_8) [tinytuya.core.XenonDevice] Error decoding received data - read retry 0/1
Traceback (most recent call last):
  File "/usr/local/lib/python3.14/site-packages/tinytuya/core/XenonDevice.py", line 572, in _send_receive
    rmsg = self._receive()
  File "/usr/local/lib/python3.14/site-packages/tinytuya/core/XenonDevice.py", line 444, in _receive
    data = self._recv_all( min_len )
  File "/usr/local/lib/python3.14/site-packages/tinytuya/core/XenonDevice.py", line 424, in _recv_all
    raise DecodeError('No data received - connection closed?')
tinytuya.core.exceptions.DecodeError: No data received - connection closed?
2026-04-09 23:23:50.793 DEBUG (SyncWorker_8) [tinytuya.core.XenonDevice] _recv_all(): no data? b''
2026-04-09 23:23:50.803 DEBUG (SyncWorker_8) [tinytuya.core.XenonDevice] _recv_all(): no data? b''
2026-04-09 23:23:50.803 DEBUG (SyncWorker_8) [tinytuya.core.XenonDevice] Error decoding received data - read retry 1/1
Traceback (most recent call last):
  File "/usr/local/lib/python3.14/site-packages/tinytuya/core/XenonDevice.py", line 572, in _send_receive
    rmsg = self._receive()
  File "/usr/local/lib/python3.14/site-packages/tinytuya/core/XenonDevice.py", line 444, in _receive
    data = self._recv_all( min_len )
  File "/usr/local/lib/python3.14/site-packages/tinytuya/core/XenonDevice.py", line 424, in _recv_all
    raise DecodeError('No data received - connection closed?')
tinytuya.core.exceptions.DecodeError: No data received - connection closed?
2026-04-09 23:23:50.808 DEBUG (SyncWorker_8) [tinytuya.core.error_helper] ERROR Unexpected Payload from Device - 904 - payload: null
2026-04-09 23:23:50.810 WARNING (MainThread) [custom_components.tuya_local.device] EV Charger error reading: Unexpected Payload from Device
2026-04-09 23:23:50.911 DEBUG (SyncWorker_11) [tinytuya.core.XenonDevice] status() entry (dev_type is default)
2026-04-09 23:23:50.912 DEBUG (SyncWorker_11) [tinytuya.core.XenonDevice] building command 10 payload=b'{}'
2026-04-09 23:23:50.915 DEBUG (SyncWorker_11) [tinytuya.core.XenonDevice] sending payload quick
2026-04-09 23:23:50.916 DEBUG (SyncWorker_11) [tinytuya.core.XenonDevice] final payload: b'0123456789abcdef'
```

Using latest (2026.4.0) version.

**Comment by InToSSH** [comment]
Oh, glad to see I am not alone. I also started seeing issues with my Feyree EV charger. It has been working fine for over a year. After the update to 2026.4.0 it stops responding every two days or something like that. I thought it was a wifi interference, but changing the channel did not work. The Tuya app sees the charger online all the time and I can see the real data and control the charger, but it is in a weird state, when if I do the network check, it says the network connection is abnormal and I can't change wifi settings. Ping on the IP is good withing 3ms on my side. It just looks like part of the tuya protocol gets jammed somehow and it stays in this broken state until I power cycle the charger.

**Comment by OldSmurf56** [comment]
Me too ... I would like to add that I have 2 Feyree chargers. One 22kW type that still works flawlessly and an 11kW charger that is no longer available in HA. Both still work fine from the SmartLife app.
I also tried different tricks to get the 11kW back into HA, but ended up downgrading the TuyaLocal integration back to 2026.3.1 which did the trick for the 11kW charger.

**Comment by KrzysztofSzechinski** [comment]
My Feyree EV charger also stopped working in Tuya local in HA. It works normally in the Tuya app.

**Comment by istaveren** [comment]
A power cycle of the EV charger brought it back in HA. As suggested by @InToSSH .
Will track it to see if the problem will come back.

**Comment by JRCondat** [comment]
Same problem.

**Comment by peyanski** [comment]
same problem here. It was working great before last update and I can't easily power cycle it

**Comment by Croog** [comment]
@istaveren I am afraid, it will. For me it started 31.3. after several months of rock stable connection. Until that time the charger become unavailable several times. I did blocked external internal connectivity to charger so there are no interference with Tyua cloud, but no luck. The situation repeated again.  When it happens, entities reports as "Unavailable" and even HA restart doesn't help - only after that entities are shown as "N/A". 

Before I blocked connection to Tuya cloud I have confirmed that charger communicate no problem via external cloud when it is not available to HA locally fot this reason. The only way how to resume connection with HA is to reconnect charger from power source. 

@make-all I really don't think this is caused by the charger itself. And I am confident to say it is not because the device is jammed by a cloud connectivity.

**Comment by InToSSH** [comment]
@Croog right, same behavior with mine. The power cycle alone will not solve it, just make it work for another few hours before the condition repeats. I now downgraded to 2026.3.1 and so far so good. I don't think this has something to do with the charger itself, but there might have been some change in the protocol by this integration and now it sends some data or polls some data from the charger in a way it makes it get stuck in this weird semifunctional state. 

In the changelog I see this about feyree chargers, maybe our chargers use this new device type as well? https://github.com/make-all/tuya-local/pull/4800

**Comment by Nevynnyi** [comment]
The same with atorch GR2PWS. Аfter some time stop working, ping ok, but integration not work.
{
    "Error": "Check device key or version",
    "Err": "914",
    "Payload": null
}

After power off device or reset wifi and change local key it works again, but just few hours.

**Comment by emmdu06** [comment]
Same issue here. Sensors becoming unavailable. Rebooting the Feyree and it works for another 24 h or so.

Looking at the network traces during the issue, the integration connects to the charger, sends 1 data segment and the charger resets the connection.

   192.168.0.14.56444 > 192.168.0.206.6668: Flags [S], cksum 0x930d (correct), seq 1762466599, win 64240, options [mss 1460,sackOK,TS val 2147368217 ecr 0,nop,wscale 7], length 0
21:23:22.371239 IP (tos 0x0, ttl 255, id 36490, offset 0, flags [none], proto TCP (6), length 44)
    192.168.0.206.6668 > 192.168.0.14.56444: Flags [S.], cksum 0x39fe (correct), seq 659631732, ack 1762466600, win 2920, options [mss 1460], length 0
21:23:22.371554 IP (tos 0x0, ttl 64, id 19914, offset 0, flags [DF], proto TCP (6), length 40)
    192.168.0.14.56444 > 192.168.0.206.6668: Flags [.], cksum 0x6232 (correct), seq 1, ack 1, win 64240, length 0
21:23:22.372289 IP (tos 0x0, ttl 64, id 19915, offset 0, flags [DF], proto TCP (6), length 175)
    192.168.0.14.56444 > 192.168.0.206.6668: Flags [P.], cksum 0x0e07 (correct), seq 1:136, ack 1, win 64240, length 135
21:23:22.381230 IP (tos 0x0, ttl 255, id 36491, offset 0, flags [none], proto TCP (6), length 40)
    192.168.0.206.6668 > 192.168.0.14.56444: Flags [.], cksum 0x51bb (correct), seq 1, ack 136, win 2785, length 0
21:23:22.381247 IP (tos 0x0, ttl 255, id 36492, offset 0, flags [none], proto TCP (6), length 40)
    192.168.0.206.6668 > 192.168.0.14.56444: Flags [R.], cksum 0x5130 (correct), seq 1, ack 136, win 2920, length 0

**Comment by istaveren** [comment]
Installed version 2026.4.1 but the device doesn't come back online.

**Comment by InToSSH** [comment]
> Installed version 2026.4.1 but the device doesn't come back online.

As mentioned multiple times, you need to reboot the device for it to come back. Once it is in broken state, upgrading the integration won't fix it.
